{
  "schema_version": 1,
  "registry_version": "2026-10-12-b491317",
  "generated_at": "2026-10-12T17:59:03.089Z",
  "catalog_checked_at": "2026-10-12T17:59:03.244Z",
  "catalog_model_count": 459,
  "default_track": "economy",
  "api": {
    "provider": "openrouter",
    "base_url": "https://openrouter.ai/api/v1",
    "chat_path": "/chat/completions"
  },
  "brands": [
    {
      "brand_id": "openai",
      "display_name": "OpenAI",
      "priority": 1,
      "tracks": {
        "economy": {
          "status": "active",
          "config_id": "7353e27780c1",
          "model_id": "openai/gpt-6-luna",
          "canonical_slug": "openai/gpt-6-luna-20260922",
          "display_name": "OpenAI: GPT-6 Luna",
          "request_parameters": {
            "reasoning": {
              "enabled": false
            }
          },
          "provider_policy": {
            "require_parameters": false,
            "allow_fallbacks": true
          },
          "pricing": {
            "currency": "USD",
            "prompt_per_token": "0.0000001",
            "completion_per_token": "0.0000005",
            "basis": "catalog",
            "checked_at": "2026-10-12T17:59:03.244Z"
          },
          "context_length": 1050000,
          "expiration_date": null,
          "validation": {
            "status": "static-checks",
            "checked_at": "2026-10-12T17:59:03.089Z"
          },
          "selection": {
            "reason": "Cheapest current-generation OpenAI chat tier ($0.10/$0.50 per MTok) that can disable reasoning (supports effort 'none'). gpt-5-nano is cheaper but reasoning-mandatory.",
            "evidence": [
              "OpenRouter catalog 2026-09-29: reasoning.mandatory=false, supported_efforts includes 'none'"
            ]
          }
        },
        "flagship": {
          "status": "active",
          "config_id": "f51e8ebff611",
          "model_id": "openai/gpt-6-sol",
          "canonical_slug": "openai/gpt-6-sol-20260922",
          "display_name": "OpenAI: GPT-6 Sol",
          "request_parameters": {
            "reasoning": {
              "enabled": false
            }
          },
          "provider_policy": {
            "require_parameters": false,
            "allow_fallbacks": true
          },
          "pricing": {
            "currency": "USD",
            "prompt_per_token": "0.000002",
            "completion_per_token": "0.00001",
            "basis": "catalog",
            "checked_at": "2026-10-12T17:59:03.244Z"
          },
          "context_length": 1050000,
          "expiration_date": null,
          "validation": {
            "status": "static-checks",
            "checked_at": "2026-10-12T17:59:03.089Z"
          },
          "selection": {
            "reason": "Strongest OpenAI model that honors reasoning-off (gpt-6-astra and gpt-5.x pro tiers are reasoning-mandatory or reasoning-priced).",
            "evidence": [
              "OpenRouter catalog 2026-09-29: reasoning.mandatory=false, supported_efforts includes 'none'"
            ]
          }
        }
      }
    },
    {
      "brand_id": "anthropic",
      "display_name": "Anthropic",
      "priority": 2,
      "tracks": {
        "economy": {
          "status": "active",
          "config_id": "56c799095ee9",
          "model_id": "anthropic/claude-haiku-4.5",
          "canonical_slug": "anthropic/claude-4.5-haiku-20251001",
          "display_name": "Anthropic: Claude Haiku 4.5",
          "request_parameters": {
            "temperature": 0.9,
            "reasoning": {
              "enabled": false
            }
          },
          "provider_policy": {
            "require_parameters": false,
            "allow_fallbacks": true
          },
          "pricing": {
            "currency": "USD",
            "prompt_per_token": "0.000001",
            "completion_per_token": "0.000005",
            "basis": "catalog",
            "checked_at": "2026-10-12T17:59:03.244Z"
          },
          "context_length": 200000,
          "expiration_date": null,
          "validation": {
            "status": "static-checks",
            "checked_at": "2026-10-12T17:59:03.089Z"
          },
          "selection": {
            "reason": "Reference CHEAP_ROSTER incumbent, battle-tested in the game.",
            "evidence": [
              "reference CHEAP_ROSTER (slugs verified live)",
              "OpenRouter catalog 2026-09-29: reasoning.mandatory=false"
            ]
          }
        },
        "flagship": {
          "status": "suspended",
          "reason": "approved request parameter \"temperature\" unsupported by the model",
          "model_id": "anthropic/claude-opus-5",
          "config_id": "558cd66d749e"
        }
      }
    },
    {
      "brand_id": "google",
      "display_name": "Google",
      "priority": 3,
      "tracks": {
        "economy": {
          "status": "active",
          "config_id": "04b50c567510",
          "model_id": "google/gemini-3.1-flash-lite",
          "canonical_slug": "google/gemini-3.1-flash-lite-20260507",
          "display_name": "Google: Gemini 3.1 Flash Lite",
          "request_parameters": {
            "temperature": 0.9,
            "reasoning": {
              "effort": "minimal"
            }
          },
          "provider_policy": {
            "require_parameters": false,
            "allow_fallbacks": true
          },
          "pricing": {
            "currency": "USD",
            "prompt_per_token": "0.00000025",
            "completion_per_token": "0.0000015",
            "basis": "catalog",
            "checked_at": "2026-10-12T17:59:03.244Z"
          },
          "context_length": 1048576,
          "expiration_date": null,
          "validation": {
            "status": "static-checks",
            "checked_at": "2026-10-12T17:59:03.089Z"
          },
          "selection": {
            "reason": "Reference CHEAP_ROSTER incumbent. Google models only accept effort 'minimal' as the off-position — the harness already special-cases this.",
            "evidence": [
              "reference CHEAP_ROSTER (slugs verified live)",
              "OpenRouter catalog 2026-09-29: supported_efforts includes 'minimal'"
            ]
          }
        },
        "flagship": {
          "status": "active",
          "config_id": "4d3b37e418cd",
          "model_id": "google/gemini-3.6-flash",
          "canonical_slug": "google/gemini-3.6-flash-20260721",
          "display_name": "Google: Gemini 3.6 Flash",
          "request_parameters": {
            "temperature": 0.9,
            "reasoning": {
              "effort": "minimal"
            }
          },
          "provider_policy": {
            "require_parameters": false,
            "allow_fallbacks": true
          },
          "pricing": {
            "currency": "USD",
            "prompt_per_token": "0.00000075",
            "completion_per_token": "0.00000375",
            "basis": "catalog",
            "checked_at": "2026-10-12T17:59:03.244Z"
          },
          "context_length": 1048576,
          "expiration_date": null,
          "validation": {
            "status": "static-checks",
            "checked_at": "2026-10-12T17:59:03.089Z"
          },
          "selection": {
            "reason": "Newest Gemini that still supports effort 'minimal' (3.7-flash and 3.8-flash floor at 'low', which burns reasoning tokens against the 110-token game budget). No stable non-preview Gemini Pro exists on OpenRouter; gemini-2.5-pro expires 2026-10-20.",
            "evidence": [
              "reference FRONTIER_ROSTER (live-tested Aug 2026)",
              "OpenRouter catalog 2026-09-29: supported_efforts includes 'minimal'"
            ]
          }
        }
      }
    },
    {
      "brand_id": "xai",
      "display_name": "xAI / Grok",
      "priority": 4,
      "tracks": {
        "economy": {
          "status": "active",
          "config_id": "2944d7fb8baa",
          "model_id": "x-ai/grok-4.3",
          "canonical_slug": "x-ai/grok-4.3-20260430",
          "display_name": "SpaceXAI: Grok 4.3",
          "request_parameters": {
            "temperature": 0.9,
            "reasoning": {
              "enabled": false
            }
          },
          "provider_policy": {
            "require_parameters": false,
            "allow_fallbacks": true
          },
          "pricing": {
            "currency": "USD",
            "prompt_per_token": "0.00000125",
            "completion_per_token": "0.0000025",
            "basis": "catalog",
            "checked_at": "2026-10-12T17:59:03.244Z"
          },
          "context_length": 1000000,
          "expiration_date": null,
          "validation": {
            "status": "static-checks",
            "checked_at": "2026-10-12T17:59:03.089Z"
          },
          "selection": {
            "reason": "Cheapest xAI model ($1.25/$2.50 per MTok, tied with grok-4.20 but newer) that supports reasoning 'none'.",
            "evidence": [
              "OpenRouter catalog 2026-09-29: created 2026-04-30, reasoning.mandatory=false"
            ]
          }
        },
        "flagship": {
          "status": "active",
          "config_id": "2944d7fb8baa",
          "model_id": "x-ai/grok-4.3",
          "canonical_slug": "x-ai/grok-4.3-20260430",
          "display_name": "SpaceXAI: Grok 4.3",
          "request_parameters": {
            "temperature": 0.9,
            "reasoning": {
              "enabled": false
            }
          },
          "provider_policy": {
            "require_parameters": false,
            "allow_fallbacks": true
          },
          "pricing": {
            "currency": "USD",
            "prompt_per_token": "0.00000125",
            "completion_per_token": "0.0000025",
            "basis": "catalog",
            "checked_at": "2026-10-12T17:59:03.244Z"
          },
          "context_length": 1000000,
          "expiration_date": null,
          "validation": {